{"run":40,"commit":"HEAD","metric":0.586,"metrics":{"gitleaks_s":0.018,"lint_s":0.122,"precommit_ms":586,"typecheck_s":0.05,"unit_cov_s":0.545},"status":"discard","description":"spawn stdout/stderr=ignore + re-run on failure (UX preserved via re-run)","timestamp":1777070070473,"segment":0,"confidence":33.099999999999994,"iterationTokens":4873,"asi":{"hypothesis":"spawn with stdout/stderr=ignore, re-run failing stages with inherit to keep UX on failure path","noise_check":true,"rollback_reason":"median 0.598s vs prior 0.592s — within noise, no improvement; trade-off is significant code complexity (re-run logic) and slower failure path (~550ms re-run cost) for zero perf benefit","samples_s":[0.604,0.651,0.598,0.586,0.588]}}
{"run":41,"commit":"HEAD","metric":0.583,"metrics":{"gitleaks_s":0.018,"lint_s":0.136,"precommit_ms":583,"typecheck_s":0.052,"unit_cov_s":0.567},"status":"keep","description":"Inline pre-commit orchestrator in .husky/pre-commit (skip sh wrapper)","timestamp":1777070123186,"segment":0,"confidence":33.66101694915253,"iterationTokens":4980,"asi":{"correctness":"8/8 hook invocations pass","hypothesis":"inline orchestration in .husky/pre-commit with #!/usr/bin/env bun shebang — skips the sh wrapper and a separate scripts/precommit.ts file, removing one indirection layer","samples_s":[0.613,0.584,0.583,0.585,0.6],"summary":"median 0.585s vs prior 0.592s; ~7ms wall reduction. Hook is now self-contained at 1.7KB."}}
{"run":42,"commit":"0e33feb","metric":0.587,"metrics":{"gitleaks_s":0.016,"lint_s":0.116,"precommit_ms":587,"typecheck_s":0.052,"unit_cov_s":0.548},"status":"keep","description":"Stability sample (sh wrapper + scripts/precommit.ts)","timestamp":1777070177238,"segment":0,"confidence":37.237500000000004,"iterationTokens":5762,"asi":{"hypothesis":"stability sample after restoring sh wrapper for husky compatibility","noise_check":true,"samples_s":[0.623,0.588,0.594,0.596,0.587],"summary":"median 0.594s, range 0.587-0.623s; sh wrapper adds ~5-10ms vs inlined hook but is required for husky 9 (which sources hooks via `sh -e $hook`, ignoring shebangs)"}}
{"run":43,"commit":"482b9d4","metric":0.578,"metrics":{"gitleaks_s":0.017,"lint_s":0.122,"precommit_ms":578,"typecheck_s":0.05,"unit_cov_s":0.549},"status":"keep","description":"Doc updates (autoresearch.md, ideas) + stability sample","timestamp":1777070227947,"segment":0,"confidence":40.842465753424655,"iterationTokens":4386,"asi":{"hypothesis":"doc updates + stability sample","noise_check":true,"samples_s":[0.631,0.578,0.585],"summary":"stable ~0.58s median, -91% from baseline"}}
{"run":44,"commit":"HEAD","metric":0.583,"metrics":{"gitleaks_s":0.017,"lint_s":0.046,"precommit_ms":583,"typecheck_s":0.05,"unit_cov_s":0.574},"status":"discard","description":"Replace lint-staged with biome --staged --write","timestamp":1777070268725,"segment":0,"confidence":41.8456140350877,"iterationTokens":1921,"asi":{"correctness":"biome --staged --write writes to working tree but does NOT re-stage modified files — commit would contain pre-format version. Verified with synthetic test file.","hypothesis":"replace lint-staged with biome --staged --write directly","rollback_reason":"CORRECTNESS REGRESSION — biome rewrites files but doesn't `git add` them. lint-staged does. Without re-staging, biome's auto-fixes never make it into the commit. Could fix with explicit git diff --cached --name-only --diff-filter=AM | xargs git add but that adds another process to lint stage; not worth ~55ms saving on a non-critical path.","samples_s":[0.647,0.584,0.591,0.583,0.612],"wall_unchanged":true}}
{"run":45,"commit":"0e3405e","metric":0.579,"metrics":{"gitleaks_s":0.016,"lint_s":0.111,"precommit_ms":579,"typecheck_s":0.051,"unit_cov_s":0.543},"status":"keep","description":"Stability sample (post-discard) + idea pruning","timestamp":1777070294750,"segment":0,"confidence":42.899280575539564,"iterationTokens":3769,"asi":{"hypothesis":"stability sample post-revert + ideas updated","noise_check":true,"samples_s":[0.592,0.614,0.579]}}
{"run":46,"commit":"13047c8","metric":0.575,"metrics":{"gitleaks_s":0.016,"lint_s":0.11,"precommit_ms":575,"typecheck_s":0.051,"unit_cov_s":0.537},"status":"keep","description":"5x stability sample","timestamp":1777070313767,"segment":0,"confidence":43.389090909090925,"iterationTokens":1643,"asi":{"hypothesis":"5x stability sample","noise_check":true,"samples_s":[0.611,0.598,0.594,0.58,0.575],"summary":"median 0.594s, range 0.575-0.611s"}}
{"run":47,"commit":"HEAD","metric":0.61,"metrics":{"gitleaks_s":0.018,"lint_s":0.113,"precommit_ms":610,"typecheck_s":0.051,"unit_cov_s":0.572},"status":"discard","description":"Stability sample + maxThreads sweep re-confirmation","timestamp":1777070363192,"segment":0,"confidence":43.86764705882353,"iterationTokens":2912,"asi":{"hypothesis":"stability sample, also confirmed maxThreads=12 still optimal (sweep 8/10/12/14/16, 12 best at 0.541-0.547s isolated)","noise_check":true,"summary":"median 0.594-0.61s; floor confirmed"}}
{"run":48,"commit":"HEAD","metric":0.586,"metrics":{"gitleaks_s":0.017,"lint_s":0.125,"precommit_ms":586,"typecheck_s":0.05,"unit_cov_s":0.549},"status":"discard","description":"5x stability sample","timestamp":1777070382424,"segment":0,"confidence":43.86764705882353,"iterationTokens":1459,"asi":{"hypothesis":"5x stability sample","noise_check":true,"samples_s":[0.626,0.607,0.601,0.631,0.586]}}
{"run":49,"commit":"HEAD","metric":0.622,"metrics":{"gitleaks_s":0.016,"lint_s":0.123,"precommit_ms":622,"typecheck_s":0.051,"unit_cov_s":0.582},"status":"discard","description":"Stability sample","timestamp":1777070395875,"segment":0,"confidence":43.86764705882353,"iterationTokens":1521,"asi":{"hypothesis":"stability sample","noise_check":true}}
{"run":50,"commit":"HEAD","metric":0.584,"metrics":{"gitleaks_s":0.016,"lint_s":0.123,"precommit_ms":584,"typecheck_s":0.051,"unit_cov_s":0.545},"status":"discard","description":"Stability sample","timestamp":1777070404585,"segment":0,"confidence":44.19259259259261,"iterationTokens":1085,"asi":{"hypothesis":"stability sample","noise_check":true}}
{"run":51,"commit":"HEAD","metric":0.576,"metrics":{"gitleaks_s":0.017,"lint_s":0.113,"precommit_ms":576,"typecheck_s":0.051,"unit_cov_s":0.541},"status":"discard","description":"Stability sample","timestamp":1777070418905,"segment":0,"confidence":44.19259259259259,"iterationTokens":1263,"asi":{"hypothesis":"stability sample","noise_check":true}}
{"run":52,"commit":"HEAD","metric":0.579,"metrics":{"gitleaks_s":0.017,"lint_s":0.122,"precommit_ms":579,"typecheck_s":0.051,"unit_cov_s":0.541},"status":"discard","description":"5x stability sample","timestamp":1777070505257,"segment":0,"confidence":46.609375,"iterationTokens":5844,"asi":{"hypothesis":"5x stability sample; also tested bun build precompile (no help) and threads pool with no-isolate (flaky/slow). Floor confirmed.","noise_check":true,"samples_s":[0.603,0.58,0.637,0.607,0.579],"summary":"median 0.603s, range 0.579-0.637s"}}
{"run":53,"commit":"5c999cd","metric":0.59,"metrics":{"gitleaks_s":0.017,"lint_s":0.111,"precommit_ms":590,"typecheck_s":0.051,"unit_cov_s":0.555},"status":"keep","description":"Stability sample + ideas pruned","timestamp":1777070524539,"segment":0,"confidence":49.30578512396694,"iterationTokens":1837,"asi":{"hypothesis":"stability sample + ideas pruned (added bun build, --no-isolate observations)","noise_check":true}}
{"run":54,"commit":"HEAD","metric":0.579,"metrics":{"gitleaks_s":0.017,"lint_s":0.121,"precommit_ms":579,"typecheck_s":0.051,"unit_cov_s":0.543},"status":"discard","description":"Stability sample","timestamp":1777070538305,"segment":0,"confidence":49.92468619246865,"iterationTokens":1326,"asi":{"hypothesis":"stability sample","noise_check":true}}
{"run":55,"commit":"HEAD","metric":0.643,"metrics":{"gitleaks_s":0.026,"lint_s":0.129,"precommit_ms":643,"typecheck_s":0.053,"unit_cov_s":0.601},"status":"discard","description":"Stability sample","timestamp":1777082112817,"segment":0,"confidence":50.55932203389831,"iterationTokens":1137,"asi":{"hypothesis":"stability sample","noise_check":true}}
